R-058,"The server should be able to announce and enforce file-size limits for deposited content, by value or by reference",UP-034,Protocol,In,"This is already the case by value, so just need to be clear that the limit applies by reference.  This also may place a requirement on the provider of the reference to give a content-length header when the resource is requested.  Not essential, but could save the server having to download the resource until it reaches the size limit.","sword:maxUploadSize and sword:maxByReferenceSize; do we need to consider the difference between a max segment size, and a maximum resulting file size?"
R-059,The server should be able to hit callbacks provided by the client at key points in the deposit workflow,UP-035,Protocol,Out,"This places too much burden on the server, with the additional complexities which involve calling a remote link.  It also implies that the sword interface would pervade the entire repository workflow, which it may not be able to.",No action
R-060,The server should be allowed to accept a deposit without processing it synchronously to the client's request,UP-036,Protocol,In,Just respond with a 202 in these cases,Server may now respond with a 202.
R-061,"Clients must be able to monitor ""accepted"" but not yet processed deposits, to determine when they have been completed",UP-036,Protocol,In,See R-041 - this is likely just an additional status.,sword:state with a set of standard statuses allows this
R-062,Be able to specify detailed file-level access restrictions during deposit,UP-037,Content Aware,Out,"See R-017 - any solution for embargo could be extendable to a more thorough access restrictions set.  Places burdens on the repository to support access restrictions, so may need to be able to announce levels of support.",See R-017
R-063,Be able to update file-level access restrictions at some time after deposit,UP-037,Content Aware,Out,See R-062,See R-062
R-064,Be able to expose validation and minimum requirements for metadata and/or content being deposited/updated,UP-038,"Protocol, Content Aware",In/Out,"Propose that the spec contains the capability to pass validation messages, but does not say anything about validation itself.  Validation and minimum requirements should come from the definition of the package or metadata format, which will need to be handled outslde the spec.","Server should use an error document and the sword:log field for this information.  If the server accepts a record but does not process it straight away, the originalDeposit record could be annotated with a sword:log record in the event that validation has failed.

This is a minimal approach to validation, as it should not be a significant part of the spec."
R-065,"Format identification URIs (e.g. for packages) should be able to handle a hierarchy of increasing specificity.  e.g. a URI may identify a DSpace METS SIP, which is in turn a refinement on a METS package, which is in turn a refinement of a plain unstructured package",UP-038,Content Aware,In/Out,This is a question for a package registry,No action
R-066,"Repositories should be able to expose their level of protocol support (particularly any optional components), protocol version, and supported content types",UP-039,Protocol,In,"Review the requirements above, and identify which elements are optional or variable.  Then we just need an extensible portion of the spec which allows the repo to announce its support levels",Every aspect of the protocol can now be determined through the service document through feature flags.  Actions then available on individual deposited items are also available as flags in the status document