URL,Description
File-URL,A single Binary File within the Object
FileSet-URL,The aggregate of all Binary Files associated with the Object which are available for SWORD protocol operations to be carried out on them
Metadata-URL,The Metadata resource associated with the Object
Object-URL,"An Object that exists on the server, probably as a result of a deposit operation, which is a container for Metadata and zero or more Files."
Service-URL,"The location of the document which describes the server's capabilities for the user, and which may accept initial deposits"
Staging-URL,A URL provided by the Service where clients can initialise segmented file upload requests
Temporary-URL,"A staging area where file segments can be uploaded to the server prior to a deposit operation, obtained from the Staging-URL"